"filename","image_path","tags","thumbnail_path","original_filepath"
"iStock_000015233549XLarge.jpg","processed/iStock_000015233549XLarge.jpg","kitchen stove, kitchen appliance, major appliance, gas stove, stove, gas, natural gas, gas leak, gas appliance, energy use, cooking","thumbnails/iStock_000015233549XLarge.jpg","S:/Comms/Images/Stock images [closed]/Energy Use/Cooking/iStock_000015233549XLarge.jpg"
"iStock_000022368114Medium.jpg","processed/iStock_000022368114Medium.jpg","snow, winter, home, residential area, freezing, vaillant arotherm perform vwl 185/3 as 0010037601, festivus, december 23, heat pump, vaillant, window, chair, buildings (general), windows","thumbnails/iStock_000022368114Medium.jpg","S:/Comms/Images/Stock images [closed]/Buildings (general)/windows/iStock_000022368114Medium.jpg"
"iStock_10360088_PV_bungalow_rob_hill.jpg","processed/iStock_10360088_PV_bungalow_rob_hill.jpg","solar energy, solar panel, solar power, roof, solar thermal collector, renewable energy, energy, photovoltaic system, energy supply, solar pv","thumbnails/iStock_10360088_PV_bungalow_rob_hill.jpg","S:/Comms/Images/Stock images [closed]/Energy Supply/Solar PV/iStock_10360088_PV_bungalow_rob_hill.jpg"
"iStock_10660326.jpg","processed/iStock_10660326.jpg","blue, solar energy, solar panel, solar power, solar cell, polycrystal, photovoltaics, energy supply, solar pv","thumbnails/iStock_10660326.jpg","S:/Comms/Images/Stock images [closed]/Energy Supply/Solar PV/iStock_10660326.jpg"
"iStock_10743454_manuel velasco.jpg","processed/iStock_10743454_manuel velasco.jpg","measuring instrument, technology, number, machine, electronics, energy use, energy monitors, meters & bills, electricity meters, energy monitors, meters & bills","thumbnails/iStock_10743454_manuel velasco.jpg","S:/Comms/Images/Stock images [closed]/Energy Use/Energy Monitors, Meters & Bills/electricity meters/iStock_10743454_manuel velasco.jpg"
"iStock_11793647_mould_©Timur Arbaev.jpg","processed/iStock_11793647_mould_©Timur Arbaev.jpg","stain, silver, mold, fungus, plaster, window, condensation, damp, window sill, damp & condensation","thumbnails/iStock_11793647_mould_©Timur Arbaev.jpg","S:/Comms/Images/Stock images [closed]/Damp & Condensation/iStock_11793647_mould_©Timur Arbaev.jpg"
"iStock_12271725_dog_radiator.jpg","processed/iStock_12271725_dog_radiator.jpg","dog, carnivores, fur, snout, canidae, akita inu, icelandic sheepdog, shiba inu, pembroke welsh corgi, norwegian lundehund, energy use, heating-systems, radiators","thumbnails/iStock_12271725_dog_radiator.jpg","S:/Comms/Images/Stock images [closed]/Energy Use/heating-systems/Radiators/iStock_12271725_dog_radiator.jpg"
"iStock_12426005_plug_and_flex.jpg","processed/iStock_12426005_plug_and_flex.jpg","electronic device, electrical cable, technology, wire, electrical wiring, kebo, hdmi, power plug standard, ethernet, bracelet, energy use, appliances","thumbnails/iStock_12426005_plug_and_flex.jpg","S:/Comms/Images/Stock images [closed]/Energy Use/Appliances/iStock_12426005_plug_and_flex.jpg"
"iStock_12426005_plug_and_flex_white_bg.jpg","processed/iStock_12426005_plug_and_flex_white_bg.jpg","electronic device, electrical cable, technology, wire, extension cord, kebo, hdmi, power plug standard, ethernet, bracelet, energy use, appliances","thumbnails/iStock_12426005_plug_and_flex_white_bg.jpg","S:/Comms/Images/Stock images [closed]/Energy Use/Appliances/iStock_12426005_plug_and_flex_white_bg.jpg"
"iStock_12681703_pv_on_terrace.jpg","processed/iStock_12681703_pv_on_terrace.jpg","solar energy, solar panel, solar power, composite material, solar thermal collector, electricity, solar cell, photovoltaics, window, energy supply, solar pv","thumbnails/iStock_12681703_pv_on_terrace.jpg","S:/Comms/Images/Stock images [closed]/Energy Supply/Solar PV/iStock_12681703_pv_on_terrace.jpg"
"iStock_12740389_fernando_alonso_herrero.jpg","processed/iStock_12740389_fernando_alonso_herrero.jpg","solar energy, solar panel, solar power, technology, solar thermal collector, photovoltaics, solar inverter, solar cell, energy supply, solar pv","thumbnails/iStock_12740389_fernando_alonso_herrero.jpg","S:/Comms/Images/Stock images [closed]/Energy Supply/Solar PV/iStock_12740389_fernando_alonso_herrero.jpg"
"iStock_12798285_plug_socket_alan_crawford.jpg","processed/iStock_12798285_plug_socket_alan_crawford.jpg","wall socket, ac power plugs and sockets, power plug standard, energy use, electric sockets, plugs etc, electric sockets, plugs etc","thumbnails/iStock_12798285_plug_socket_alan_crawford.jpg","S:/Comms/Images/Stock images [closed]/Energy Use/electric sockets, plugs etc/iStock_12798285_plug_socket_alan_crawford.jpg"
"iStock_13914467solarPV_suburban_home.jpg","processed/iStock_13914467solarPV_suburban_home.jpg","solar energy, solar panel, solar power, roof, solar thermal collector, photovoltaics, photovoltaic system, window, house, energy supply, solar pv","thumbnails/iStock_13914467solarPV_suburban_home.jpg","S:/Comms/Images/Stock images [closed]/Energy Supply/Solar PV/iStock_13914467solarPV_suburban_home.jpg"
"iStock_1481602_boiler_flame_Gordan_Poropat.jpg","processed/iStock_1481602_boiler_flame_Gordan_Poropat.jpg","blue, lighting, technology, neon, lens flare, heating system, boiler, central heating, convection heater, gázkazán, energy use, heating-systems, boilers","thumbnails/iStock_1481602_boiler_flame_Gordan_Poropat.jpg","S:/Comms/Images/Stock images [closed]/Energy Use/heating-systems/boilers/iStock_1481602_boiler_flame_Gordan_Poropat.jpg"
"iStock_16624445_brett_charlton.jpg","processed/iStock_16624445_brett_charlton.jpg","solar energy, solar panel, solar power, roof, solar thermal collector, stock photography, building, window, energy supply, solar pv","thumbnails/iStock_16624445_brett_charlton.jpg","S:/Comms/Images/Stock images [closed]/Energy Supply/Solar PV/iStock_16624445_brett_charlton.jpg"
"iStock_16624445_brett_charlton_small.jpg","processed/iStock_16624445_brett_charlton_small.jpg","solar energy, solar panel, solar power, roof, solar thermal collector, stock photography, building, window, energy supply, solar pv","thumbnails/iStock_16624445_brett_charlton_small.jpg","S:/Comms/Images/Stock images [closed]/Energy Supply/Solar PV/iStock_16624445_brett_charlton_small.jpg"
"iStock_16624445_brett_charlton_small_cropped.jpg","processed/iStock_16624445_brett_charlton_small_cropped.jpg","solar energy, solar panel, solar power, roof, solar thermal collector, stock photography, image, window, house, energy supply, solar pv","thumbnails/iStock_16624445_brett_charlton_small_cropped.jpg","S:/Comms/Images/Stock images [closed]/Energy Supply/Solar PV/iStock_16624445_brett_charlton_small_cropped.jpg"
"iStock_1664346.jpg","processed/iStock_1664346.jpg","silo, industry, storage tank, cylinder, factory, stock photography, istock, image, stock.xchng, photograph, energy supply, anaerobic digestion","thumbnails/iStock_1664346.jpg","S:/Comms/Images/Stock images [closed]/Energy Supply/Anaerobic Digestion/iStock_1664346.jpg"
"iStock_18766963_cat_erik_zunec-cut-out.jpg","processed/iStock_18766963_cat_erik_zunec-cut-out.jpg","cat, felidae, carnivores, felinae, fur, american shorthair, bengal cat, ocicat, european shorthair, egyptian mau, energy use, heating-systems, radiators","thumbnails/iStock_18766963_cat_erik_zunec-cut-out.jpg","S:/Comms/Images/Stock images [closed]/Energy Use/heating-systems/Radiators/iStock_18766963_cat_erik_zunec-cut-out.jpg"
"iStock_18766963_cat_erik_zunec-cut-out2.jpg","processed/iStock_18766963_cat_erik_zunec-cut-out2.jpg","cat, felidae, carnivores, felinae, whiskers, american shorthair, manx cat, ocicat, european shorthair, tabby cat, energy use, heating-systems, radiators","thumbnails/iStock_18766963_cat_erik_zunec-cut-out2.jpg","S:/Comms/Images/Stock images [closed]/Energy Use/heating-systems/Radiators/iStock_18766963_cat_erik_zunec-cut-out2.jpg"
"iStock_18766963_cat_erik_zunec_extra_space.jpg","processed/iStock_18766963_cat_erik_zunec_extra_space.jpg","cat, felidae, felinae, carnivores, whiskers, toyger, ocicat, european shorthair, arabian mau, california spangled, energy use, heating-systems, radiators","thumbnails/iStock_18766963_cat_erik_zunec_extra_space.jpg","S:/Comms/Images/Stock images [closed]/Energy Use/heating-systems/Radiators/iStock_18766963_cat_erik_zunec_extra_space.jpg"
"iStock_18766963_cat_erik_zunec_more-extra_space.jpg","processed/iStock_18766963_cat_erik_zunec_more-extra_space.jpg","cat, felidae, carnivores, felinae, fur, european shorthair, egyptian mau, american shorthair, british shorthair, arabian mau, energy use, heating-systems, radiators","thumbnails/iStock_18766963_cat_erik_zunec_more-extra_space.jpg","S:/Comms/Images/Stock images [closed]/Energy Use/heating-systems/Radiators/iStock_18766963_cat_erik_zunec_more-extra_space.jpg"
"iStock_18766963_cat_more-radiator.jpg","processed/iStock_18766963_cat_more-radiator.jpg","cat, felidae, felinae, carnivores, fur, egyptian mau, european shorthair, arabian mau, california spangled, australian mist, energy use, heating-systems, radiators","thumbnails/iStock_18766963_cat_more-radiator.jpg","S:/Comms/Images/Stock images [closed]/Energy Use/heating-systems/Radiators/iStock_18766963_cat_more-radiator.jpg"
"iStock_21635299.jpg","processed/iStock_21635299.jpg","machine, nickel, valve, thermostatic radiator valve, radiator, thermostat, heating system, energy use, heating-systems, radiators","thumbnails/iStock_21635299.jpg","S:/Comms/Images/Stock images [closed]/Energy Use/heating-systems/Radiators/iStock_21635299.jpg"
"iStock_239715.jpg","processed/iStock_239715.jpg","summer, textile, plant community, spring, linens, grass, tree, lawn, top, energy use, clothes washing","thumbnails/iStock_239715.jpg","S:/Comms/Images/Stock images [closed]/Energy Use/clothes washing/iStock_239715.jpg"
"iStock_2436842-gas-flame.jpg","processed/iStock_2436842-gas-flame.jpg","orange, heat, flame, night, fire, gas, business card, natural gas, gas burner, business, energy use, gas flames","thumbnails/iStock_2436842-gas-flame.jpg","S:/Comms/Images/Stock images [closed]/Energy Use/gas flames/iStock_2436842-gas-flame.jpg"
"iStock_27134373.jpg","processed/iStock_27134373.jpg","electronic device, display device, electronics, label, electricity meter, electricity, british gas, na, smart meter, energy use, energy monitors, meters & bills, prepayment meters, energy monitors, meters & bills","thumbnails/iStock_27134373.jpg","S:/Comms/Images/Stock images [closed]/Energy Use/Energy Monitors, Meters & Bills/prepayment meters/iStock_27134373.jpg"
"iStock_2756078_room_thermostat.jpg","processed/iStock_2756078_room_thermostat.jpg","thermostat, central heating, heating system, boiler, heating, ventilation, and air conditioning, energy use, heating-systems, heating controls","thumbnails/iStock_2756078_room_thermostat.jpg","S:/Comms/Images/Stock images [closed]/Energy Use/heating-systems/Heating Controls/iStock_2756078_room_thermostat.jpg"
"iStock_2756078_room_thermostat_20degrees.jpg","processed/iStock_2756078_room_thermostat_20degrees.jpg","thermostat, clock, wall clock, wall, energy use, heating-systems, heating controls","thumbnails/iStock_2756078_room_thermostat_20degrees.jpg","S:/Comms/Images/Stock images [closed]/Energy Use/heating-systems/Heating Controls/iStock_2756078_room_thermostat_20degrees.jpg"
"iStock_28675158_dog_radiator-more-radiator.jpg","processed/iStock_28675158_dog_radiator-more-radiator.jpg","dog, carnivores, fur, canidae, beagle, drever, american foxhound, na, wart, energy use, heating-systems, radiators","thumbnails/iStock_28675158_dog_radiator-more-radiator.jpg","S:/Comms/Images/Stock images [closed]/Energy Use/heating-systems/Radiators/iStock_28675158_dog_radiator-more-radiator.jpg"
"iStock_28675158_dog_radiator.jpg","processed/iStock_28675158_dog_radiator.jpg","dog, carnivores, snout, fur, canidae, beagle, english foxhound, beaglier, american foxhound, drever, energy use, heating-systems, radiators","thumbnails/iStock_28675158_dog_radiator.jpg","S:/Comms/Images/Stock images [closed]/Energy Use/heating-systems/Radiators/iStock_28675158_dog_radiator.jpg"
"iStock_28675158_dog_radiator_small.jpg","processed/iStock_28675158_dog_radiator_small.jpg","dog, carnivores, snout, fur, canidae, beagle, harrier, beaglier, american foxhound, drever, energy use, heating-systems, radiators","thumbnails/iStock_28675158_dog_radiator_small.jpg","S:/Comms/Images/Stock images [closed]/Energy Use/heating-systems/Radiators/iStock_28675158_dog_radiator_small.jpg"
"iStock_3220703_solarthermal.jpg","processed/iStock_3220703_solarthermal.jpg","orange, solar panel, solar energy, solar power, solar thermal collector, water, concentrated solar power, solar water heating, solar thermal energy, energy supply, solar thermal","thumbnails/iStock_3220703_solarthermal.jpg","S:/Comms/Images/Stock images [closed]/Energy Supply/Solar Thermal/iStock_3220703_solarthermal.jpg"
"iStock_3220703_solarthermal_extra_sky.jpg","processed/iStock_3220703_solarthermal_extra_sky.jpg","solar panel, solar energy, technology, solar power, solar thermal collector, water, solar water heating, water heating, energy supply, solar thermal","thumbnails/iStock_3220703_solarthermal_extra_sky.jpg","S:/Comms/Images/Stock images [closed]/Energy Supply/Solar Thermal/iStock_3220703_solarthermal_extra_sky.jpg"
"iStock_40790114_oil_tanker_sail_boat_pacotoscano.jpg","processed/iStock_40790114_oil_tanker_sail_boat_pacotoscano.jpg","boat, transport, watercraft, liquid, ship, ore-bulk-oil carrier, bulk carrier, aframax, panamax, freight transport, energy supply, oil","thumbnails/iStock_40790114_oil_tanker_sail_boat_pacotoscano.jpg","S:/Comms/Images/Stock images [closed]/Energy Supply/oil/iStock_40790114_oil_tanker_sail_boat_pacotoscano.jpg"
"iStock_445319_elec_meter2.jpg","processed/iStock_445319_elec_meter2.jpg","silver, gauge, measuring instrument, electronics, public utility, electricity, avista utilities, na, natural gas, energy use, energy monitors, meters & bills, electricity meters, energy monitors, meters & bills","thumbnails/iStock_445319_elec_meter2.jpg","S:/Comms/Images/Stock images [closed]/Energy Use/Energy Monitors, Meters & Bills/electricity meters/iStock_445319_elec_meter2.jpg"
"iStock_445319_elec_meter3.jpg","processed/iStock_445319_elec_meter3.jpg","silver, gauge, measuring instrument, watch, electronics, na, avista utilities, stock photography, public utility, image, energy use, energy monitors, meters & bills, electricity meters, energy monitors, meters & bills","thumbnails/iStock_445319_elec_meter3.jpg","S:/Comms/Images/Stock images [closed]/Energy Use/Energy Monitors, Meters & Bills/electricity meters/iStock_445319_elec_meter3.jpg"
"iStock_6143058_toaster.jpg","processed/iStock_6143058_toaster.jpg","toaster, small appliance, electronic device, home appliance, kitchen appliance, stock photography, istock, image, getty images, na, energy use, appliances","thumbnails/iStock_6143058_toaster.jpg","S:/Comms/Images/Stock images [closed]/Energy Use/Appliances/iStock_6143058_toaster.jpg"
"iStock_615214 radiator valve.jpg","processed/iStock_615214 radiator valve.jpg","machine, heating system, central heating, water heating, radiator, energy use, heating-systems, radiators","thumbnails/iStock_615214 radiator valve.jpg","S:/Comms/Images/Stock images [closed]/Energy Use/heating-systems/Radiators/iStock_615214 radiator valve.jpg"
"iStock_6596698_derek_audette.jpg","processed/iStock_6596698_derek_audette.jpg","machine, gauge, measuring instrument, rust, gas meter, natural gas, gas, fuel, electricity, energy use, energy monitors, meters & bills, gas meters, energy monitors, meters & bills","thumbnails/iStock_6596698_derek_audette.jpg","S:/Comms/Images/Stock images [closed]/Energy Use/Energy Monitors, Meters & Bills/gas meters/iStock_6596698_derek_audette.jpg"
"iStock_7828161elec_meter.jpg","processed/iStock_7828161elec_meter.jpg","measuring instrument, gauge, machine, number, electricity, electricity meter, kilowatt hour, energy, electric power distribution, energy use, energy monitors, meters & bills, electricity meters, energy monitors, meters & bills","thumbnails/iStock_7828161elec_meter.jpg","S:/Comms/Images/Stock images [closed]/Energy Use/Energy Monitors, Meters & Bills/electricity meters/iStock_7828161elec_meter.jpg"
"iStock_826270_dishwasher_buttons.jpg","processed/iStock_826270_dishwasher_buttons.jpg","electronics, dishwasher, na, bosch, washing machine, robert bosch, energy use, appliances","thumbnails/iStock_826270_dishwasher_buttons.jpg","S:/Comms/Images/Stock images [closed]/Energy Use/Appliances/iStock_826270_dishwasher_buttons.jpg"
"iStock_826270_dishwasher_buttons_cropped.jpg","processed/iStock_826270_dishwasher_buttons_cropped.jpg","electronics, dishwasher, na, bosch, robert bosch, washing machine, energy use, appliances","thumbnails/iStock_826270_dishwasher_buttons_cropped.jpg","S:/Comms/Images/Stock images [closed]/Energy Use/Appliances/iStock_826270_dishwasher_buttons_cropped.jpg"
"iStock_8605026 rad valve.jpg","processed/iStock_8605026 rad valve.jpg","technology, electrical cable, ac power plugs and sockets, compact fluorescent lamp, security, central heating, heating system, glowarm, boiler, electric heating, lighting, energy use, heating-systems, radiators","thumbnails/iStock_8605026 rad valve.jpg","S:/Comms/Images/Stock images [closed]/Energy Use/heating-systems/Radiators/iStock_8605026 rad valve.jpg"
"iStock_8938706.jpg","processed/iStock_8938706.jpg","solar energy, solar panel, solar power, engineer, solar thermal collector, electricity, photovoltaics, energy, person, top, jeans, helmet, energy supply, solar pv","thumbnails/iStock_8938706.jpg","S:/Comms/Images/Stock images [closed]/Energy Supply/Solar PV/iStock_8938706.jpg"
"iStock_9539567.jpg","processed/iStock_9539567.jpg","measuring instrument, number, difficult, science, symbol, image, energy use, energy monitors, meters & bills, energy monitors, meters & bills","thumbnails/iStock_9539567.jpg","S:/Comms/Images/Stock images [closed]/Energy Use/Energy Monitors, Meters & Bills/iStock_9539567.jpg"
"iStock_9842096_windows.jpg","processed/iStock_9842096_windows.jpg","brick, brickwork, glass, sash window, building material, window, wall, glazing, insulated glazing, ventilation, buildings (general), windows","thumbnails/iStock_9842096_windows.jpg","S:/Comms/Images/Stock images [closed]/Buildings (general)/windows/iStock_9842096_windows.jpg"
"iStock_992917_yellow-kettle.jpg","processed/iStock_992917_yellow-kettle.jpg","yellow, small appliance, kitchen appliance, serveware, plastic, stock photography, kettle, cordless, electric kettle, jug, energy use, appliances","thumbnails/iStock_992917_yellow-kettle.jpg","S:/Comms/Images/Stock images [closed]/Energy Use/Appliances/kettle/iStock_992917_yellow-kettle.jpg"
"iStock6818570_yorkshire_turbines.jpg","processed/iStock6818570_yorkshire_turbines.jpg","wind turbine, windmill, wind farm, land lot, grassland, turbine, wind, energy supply","thumbnails/iStock6818570_yorkshire_turbines.jpg","S:/Comms/Images/Stock images [closed]/Energy Supply/Wind/iStock6818570_yorkshire_turbines.jpg"
"Jacksons boiler.jpg","processed/Jacksons boiler.jpg","machine, pipe, electrical cable, plywood, ceiling, room, energy supply, solar thermal","thumbnails/Jacksons boiler.jpg","S:/Comms/Images/Stock images [closed]/Energy Supply/Solar Thermal/Jacksons boiler.jpg"
"jan2020-1.jpg","processed/jan2020-1.jpg","building, urban area, facade, apartment, metropolitan area, high-rise building, suburb, architecture, tower, buildings (general), housing types, social high-rise bristol","thumbnails/jan2020-1.jpg","S:/Comms/Images/Stock images [closed]/Buildings (general)/housing types/social high-rise bristol/jan2020-1.jpg"
"jan2020-2.jpg","processed/jan2020-2.jpg","apartment, condominium, high-rise building, architecture, suburb, building, buildings (general), housing types, social high-rise bristol","thumbnails/jan2020-2.jpg","S:/Comms/Images/Stock images [closed]/Buildings (general)/housing types/social high-rise bristol/jan2020-2.jpg"
"jan2020-3.jpg","processed/jan2020-3.jpg","daytime, urban area, apartment, high-rise building, urban design, architecture, residential area, tower, building, buildings (general), housing types, social high-rise bristol","thumbnails/jan2020-3.jpg","S:/Comms/Images/Stock images [closed]/Buildings (general)/housing types/social high-rise bristol/jan2020-3.jpg"
"jan2020-4.jpg","processed/jan2020-4.jpg","facade, urban design, human settlement, apartment, mixed-use, subcompact car, suv, volkswagen, car, peugeot 307, window, buildings (general), housing types, social high-rise bristol","thumbnails/jan2020-4.jpg","S:/Comms/Images/Stock images [closed]/Buildings (general)/housing types/social high-rise bristol/jan2020-4.jpg"
"Jon installing WB.JPG","processed/Jon installing WB.JPG","roof, roofer, tradesman, building material, daylighting, construction worker, construction, laborer, person, top, jeans, hat, shoe, energy supply, solar pv, 1 world solar","thumbnails/Jon installing WB.JPG","S:/Comms/Images/Stock images [closed]/Energy Supply/Solar PV/1 world solar/Jon installing WB.JPG"
"julia-meter.jpg","processed/julia-meter.jpg","electronic device, measuring instrument, technology, number, machine, electricity, electricity meter, electrical wiring, counter, 1d barcode, energy use, energy monitors, meters & bills, electricity meters, energy monitors, meters & bills","thumbnails/julia-meter.jpg","S:/Comms/Images/Stock images [closed]/Energy Use/Energy Monitors, Meters & Bills/electricity meters/julia-meter.jpg"
"karen-water-meter.JPG","processed/karen-water-meter.JPG","gauge, measuring instrument, machine, number, cylinder, energy use, energy monitors, meters & bills, water meter, energy monitors, meters & bills","thumbnails/karen-water-meter.JPG","S:/Comms/Images/Stock images [closed]/Energy Use/Energy Monitors, Meters & Bills/water meter/karen-water-meter.JPG"
"karen_electric_meter (1).JPG","processed/karen_electric_meter (1).JPG","electronic device, technology, electronics, machine, circuit component, electrical wiring, electricity, wire, 1d barcode, energy use, energy monitors, meters & bills, electricity meters, energy monitors, meters & bills","thumbnails/karen_electric_meter (1).JPG","S:/Comms/Images/Stock images [closed]/Energy Use/Energy Monitors, Meters & Bills/electricity meters/karen_electric_meter (1).JPG"
"karen_electric_meter (2).JPG","processed/karen_electric_meter (2).JPG","electronic device, technology, electronics, machine, number, electrical wiring, electricity, wire, 1d barcode, energy use, energy monitors, meters & bills, electricity meters, energy monitors, meters & bills","thumbnails/karen_electric_meter (2).JPG","S:/Comms/Images/Stock images [closed]/Energy Use/Energy Monitors, Meters & Bills/electricity meters/karen_electric_meter (2).JPG"
"Kids water tank cropped.png","processed/Kids water tank cropped.png","pipe, machine, cylinder, cleanliness, plumbing, bristol energy network, centre for sustainable energy, pump, heat pump, person, top, energy supply, heat pumps, from blog - my heat pump and me","thumbnails/Kids water tank cropped.png","S:/Comms/Images/Stock images [closed]/Energy Supply/Heat Pumps/from blog - my heat pump and me/Kids water tank cropped.png"
"Kids water tankjpeg.jpeg","processed/Kids water tankjpeg.jpeg","pipe, machine, cylinder, person, top, clothing, energy supply, heat pumps, from blog - my heat pump and me","thumbnails/Kids water tankjpeg.jpeg","S:/Comms/Images/Stock images [closed]/Energy Supply/Heat Pumps/from blog - my heat pump and me/Kids water tankjpeg.jpeg"
"Kitchen1.JPG","processed/Kitchen1.JPG","ceiling, plaster, paint, silver, stain, room, refrigerator, damp & condensation, mouldy interior","thumbnails/Kitchen1.JPG","S:/Comms/Images/Stock images [closed]/Damp & Condensation/mouldy interior/Kitchen1.JPG"
"Kitchen2.JPG","processed/Kitchen2.JPG","kitchen appliance, major appliance, machine, home appliance, paint, room, damp & condensation, mouldy interior","thumbnails/Kitchen2.JPG","S:/Comms/Images/Stock images [closed]/Damp & Condensation/mouldy interior/Kitchen2.JPG"
"Kitchen3.JPG","processed/Kitchen3.JPG","washing machine, major appliance, clothes dryer, laundry room, laundry, dryer, clothing, bottle, bottled and jarred packaged goods, damp & condensation, mouldy interior","thumbnails/Kitchen3.JPG","S:/Comms/Images/Stock images [closed]/Damp & Condensation/mouldy interior/Kitchen3.JPG"
"knowle_west_media_centre.JPG","processed/knowle_west_media_centre.JPG","solar energy, solar panel, solar power, solar thermal collector, roof, energy supply, solar pv","thumbnails/knowle_west_media_centre.JPG","S:/Comms/Images/Stock images [closed]/Energy Supply/Solar PV/knowle_west_media_centre.JPG"
"laying district heating pipework.jpg","processed/laying district heating pipework.jpg","personal protective equipment, workwear, hard hat, high-visibility clothing, helmet, tree, person, outerwear, clothing, energy supply, district heating","thumbnails/laying district heating pipework.jpg","S:/Comms/Images/Stock images [closed]/Energy Supply/district heating/laying district heating pipework.jpg"
"lesp 05 079.jpg","processed/lesp 05 079.jpg","cameras & optics, camera, personal protective equipment, high-visibility clothing, helmet, smartphone, clothing, buildings (general), building works, genesis project","thumbnails/lesp 05 079.jpg","S:/Comms/Images/Stock images [closed]/Buildings (general)/building works/Genesis project/lesp 05 079.jpg"
"lesp 05 089.jpg","processed/lesp 05 089.jpg","wall, brown, composite material, concrete, building material, /m/083vt, architecture, building, wood, window, buildings (general), building works, genesis project","thumbnails/lesp 05 089.jpg","S:/Comms/Images/Stock images [closed]/Buildings (general)/building works/Genesis project/lesp 05 089.jpg"
