"filename","image_path","tags","thumbnail_path","original_filepath"
"film-screenshot2.JPG","processed/film-screenshot2.JPG","plastic, body piercing jewelry, jewellery, energy use, heating-systems, room heaters, stoarge heaters","thumbnails/film-screenshot2.JPG","S:/Comms/Images/Stock images [closed]/Energy Use/heating-systems/Room Heaters/stoarge heaters/film-screenshot2.JPG"
"fitting a door brush.jpg","processed/fitting a door brush.jpg","wood, flooring, floor, wood flooring, laminate flooring, draught excluder, door, interior door, proper, insulation, draughtproofing, verity's house - use freely","thumbnails/fitting a door brush.jpg","S:/Comms/Images/Stock images [closed]/Insulation/Draughtproofing/Verity's house - use freely/fitting a door brush.jpg"
"fitting a letter box draught excluder.jpg","processed/fitting a letter box draught excluder.jpg","draught excluder, energy, fit, centre for sustainable energy, paid, insulation, draughtproofing, verity's house - use freely","thumbnails/fitting a letter box draught excluder.jpg","S:/Comms/Images/Stock images [closed]/Insulation/Draughtproofing/Verity's house - use freely/fitting a letter box draught excluder.jpg"
"fitting_secondary_glazing1.jpg","processed/fitting_secondary_glazing1.jpg","sash window, molding, daylighting, paint, plaster, window, person, clothing, insulation, secondary glazing","thumbnails/fitting_secondary_glazing1.jpg","S:/Comms/Images/Stock images [closed]/Insulation/Secondary Glazing/fitting_secondary_glazing1.jpg"
"fitting_secondary_glazing2.jpg","processed/fitting_secondary_glazing2.jpg","glass, sash window, daylighting, molding, window treatment, h&m, NA, window, person, clothing, outerwear, insulation, secondary glazing","thumbnails/fitting_secondary_glazing2.jpg","S:/Comms/Images/Stock images [closed]/Insulation/Secondary Glazing/fitting_secondary_glazing2.jpg"
"fitting_secondary_glazing3.jpg","processed/fitting_secondary_glazing3.jpg","glass, sash window, molding, daylighting, window treatment, window, glazing, insulated glazing, person, clothing, insulation, secondary glazing","thumbnails/fitting_secondary_glazing3.jpg","S:/Comms/Images/Stock images [closed]/Insulation/Secondary Glazing/fitting_secondary_glazing3.jpg"
"fitting_secondary_glazing4.jpg","processed/fitting_secondary_glazing4.jpg","glass, sash window, molding, daylighting, window treatment, h&m, NA, window, clothing, insulation, secondary glazing","thumbnails/fitting_secondary_glazing4.jpg","S:/Comms/Images/Stock images [closed]/Insulation/Secondary Glazing/fitting_secondary_glazing4.jpg"
"fitting_secondary_glazing5.jpg","processed/fitting_secondary_glazing5.jpg","glass, sash window, molding, daylighting, window treatment, house, window, person, clothing, outerwear, insulation, secondary glazing","thumbnails/fitting_secondary_glazing5.jpg","S:/Comms/Images/Stock images [closed]/Insulation/Secondary Glazing/fitting_secondary_glazing5.jpg"
"fitting_secondary_glazing6.jpg","processed/fitting_secondary_glazing6.jpg","glass, sash window, daylighting, molding, window treatment, h&m, NA, window, person, clothing, outerwear, insulation, secondary glazing","thumbnails/fitting_secondary_glazing6.jpg","S:/Comms/Images/Stock images [closed]/Insulation/Secondary Glazing/fitting_secondary_glazing6.jpg"
"fitting_secondary_glazing7-crop.jpg","processed/fitting_secondary_glazing7-crop.jpg","glass, molding, sash window, daylighting, window treatment, window, glazing, insulated glazing, bay window, person, insulation, secondary glazing","thumbnails/fitting_secondary_glazing7-crop.jpg","S:/Comms/Images/Stock images [closed]/Insulation/Secondary Glazing/fitting_secondary_glazing7-crop.jpg"
"fitting_secondary_glazing7.jpg","processed/fitting_secondary_glazing7.jpg","glass, sash window, molding, daylighting, window treatment, window, glazing, insulated glazing, person, top, clothing, insulation, secondary glazing","thumbnails/fitting_secondary_glazing7.jpg","S:/Comms/Images/Stock images [closed]/Insulation/Secondary Glazing/fitting_secondary_glazing7.jpg"
"flame bitmap.jpg","processed/flame bitmap.jpg","white, flame, graphics, clip art, fire, illustration, art, logo, animal, illustrations and icons, icons and icon sets","thumbnails/flame bitmap.jpg","S:/Comms/Images/Stock images [closed]/Illustrations and icons/icons and icon sets/flame bitmap.jpg"
"flame1.jpg","processed/flame1.jpg","white, flame, graphics, clip art, fire, illustration, art, logo, animal, illustrations and icons, icons and icon sets","thumbnails/flame1.jpg","S:/Comms/Images/Stock images [closed]/Illustrations and icons/icons and icon sets/flame1.jpg"
"Flatroof_bay_box_for_green_roof.JPG","processed/Flatroof_bay_box_for_green_roof.JPG","flooring, floor, composite material, brickwork, wood stain, weimaraner, roe deer, prairie dogs, domestic rabbit, deer, person, clothing, top, insulation, roof","thumbnails/Flatroof_bay_box_for_green_roof.JPG","S:/Comms/Images/Stock images [closed]/Insulation/roof/Flatroof_bay_box_for_green_roof.JPG"
"Flavel Caress HE Traditional.jpg","processed/Flavel Caress HE Traditional.jpg","metal, silver, brass, steel, aluminium, fire, fireplace, gas, glass, wood-burning stove, energy use, heating-systems, room heaters","thumbnails/Flavel Caress HE Traditional.jpg","S:/Comms/Images/Stock images [closed]/Energy Use/heating-systems/Room Heaters/Flavel Caress HE Traditional.jpg"
"flickr_16430965151_Mike_Mozart_led_display.jpg","processed/flickr_16430965151_Mike_Mozart_led_display.jpg","technology, machine, plastic, signage, meter, energy use, lighting, bulbs","thumbnails/flickr_16430965151_Mike_Mozart_led_display.jpg","S:/Comms/Images/Stock images [closed]/Energy Use/lighting/bulbs/flickr_16430965151_Mike_Mozart_led_display.jpg"
"flickr_288909724_Andrew_Carr_lightbulbs.jpg","processed/flickr_288909724_Andrew_Carr_lightbulbs.jpg","yellow, lighting, incandescent light bulb, light bulb, light fixture, light, lamp, thermal radiation, energy use, bulbs","thumbnails/flickr_288909724_Andrew_Carr_lightbulbs.jpg","S:/Comms/Images/Stock images [closed]/Energy Use/lighting/bulbs/flickr_288909724_Andrew_Carr_lightbulbs.jpg"
"flickr_3213867343_tom_lin_tea_coat.jpg","processed/flickr_3213867343_tom_lin_tea_coat.jpg","finger, wrist, gadget, mobile phone, communication device, water, centre for sustainable energy, water services regulation authority, energy, water industry, person, outerwear, clothing, fuel poverty","thumbnails/flickr_3213867343_tom_lin_tea_coat.jpg","S:/Comms/Images/Stock images [closed]/Fuel Poverty/flickr_3213867343_tom_lin_tea_coat.jpg"
"flickr_4837264929_basf_insulation_beads.jpg","processed/flickr_4837264929_basf_insulation_beads.jpg","silver, science, insulation, plastic, basf, NA, cavity wall","thumbnails/flickr_4837264929_basf_insulation_beads.jpg","S:/Comms/Images/Stock images [closed]/Insulation/Cavity Wall/flickr_4837264929_basf_insulation_beads.jpg"
"flickr_5339384164_lisaclarke_gloves_tea.jpg","processed/flickr_5339384164_lisaclarke_gloves_tea.jpg","textile, woolen, wool, wrist, knitting, health, medicine, pressure, common cold, tea, fuel poverty","thumbnails/flickr_5339384164_lisaclarke_gloves_tea.jpg","S:/Comms/Images/Stock images [closed]/Fuel Poverty/flickr_5339384164_lisaclarke_gloves_tea.jpg"
"flickr_9934320444_knauf_insulation_blown_wool.jpg","processed/flickr_9934320444_knauf_insulation_blown_wool.jpg","workwear, building insulation, blue-collar worker, freezing, ice, insulation, mineral wool, glass wool, cellulose insulation, knauf, person, pants, clothing, loft","thumbnails/flickr_9934320444_knauf_insulation_blown_wool.jpg","S:/Comms/Images/Stock images [closed]/Insulation/Loft/flickr_9934320444_knauf_insulation_blown_wool.jpg"
"Floor_Boards David Jackson creative commons.jpg","processed/Floor_Boards David Jackson creative commons.jpg","flooring, wood, wood flooring, floor, brown, plank, wikimedia commons, lumber, insulation","thumbnails/Floor_Boards David Jackson creative commons.jpg","S:/Comms/Images/Stock images [closed]/Insulation/floor/Floor_Boards David Jackson creative commons.jpg"
"flowers.jpg","processed/flowers.jpg","flower, petal, yellow, pink, purple, wallpaper, laptop wallpaper, cosmos, aster, nature, plants","thumbnails/flowers.jpg","S:/Comms/Images/Stock images [closed]/nature/Plants/flowers.jpg"
"fluorescent-light-bulb.jpg","processed/fluorescent-light-bulb.jpg","compact fluorescent lamp, spiral, natural material, light bulb, fluorescent lamp, incandescent light bulb, light, led lamp, energy use, lighting, bulbs","thumbnails/fluorescent-light-bulb.jpg","S:/Comms/Images/Stock images [closed]/Energy Use/lighting/bulbs/fluorescent-light-bulb.jpg"
"forest1.jpg","processed/forest1.jpg","wood, trunk, spruce-fir forests, forest, woody plant, damaksnis, longleaf pine, jack pine, pond pine, red pine, nature, plants, woodland","thumbnails/forest1.jpg","S:/Comms/Images/Stock images [closed]/nature/Plants/woodland/forest1.jpg"
"forest3.jpg","processed/forest3.jpg","spruce-fir forests, forest, plant community, wilderness, larch, damaksnis, spruce–fir forests, temperate coniferous forest, old-growth forest, spruce, nature, plants, woodland","thumbnails/forest3.jpg","S:/Comms/Images/Stock images [closed]/nature/Plants/woodland/forest3.jpg"
"FREEPOST & FREEPOST PLUS 2ND CLASS.TIF","processed/FREEPOST & FREEPOST PLUS 2ND CLASS.TIF","white, number, graphics, meter, 1d barcode, illustrations and icons","thumbnails/FREEPOST & FREEPOST PLUS 2ND CLASS.TIF","S:/Comms/Images/Stock images [closed]/Illustrations and icons/FREEPOST & FREEPOST PLUS 2ND CLASS.TIF"
"from_warmer_bath.jpg","processed/from_warmer_bath.jpg","ceiling, wood, interior design, molding, room, insulation, external wall insulation, wall, thermal insulation, masonry, person, top, window, clothing, solid wall, internal","thumbnails/from_warmer_bath.jpg","S:/Comms/Images/Stock images [closed]/Insulation/Solid Wall/internal/from_warmer_bath.jpg"
"FXL_CONTROLS.JPG","processed/FXL_CONTROLS.JPG","wood, wood flooring, wood stain, hardwood, laminate flooring, storage heater, electric heating, economy 7, radiator, electricity, energy use, heating-systems, room heaters, stoarge heaters","thumbnails/FXL_CONTROLS.JPG","S:/Comms/Images/Stock images [closed]/Energy Use/heating-systems/Room Heaters/stoarge heaters/FXL_CONTROLS.JPG"
"gas convector.jpg","processed/gas convector.jpg","home appliance, electronics, infrared heater, infrared, air conditioning, room, single, energy use, heating-systems, room heaters","thumbnails/gas convector.jpg","S:/Comms/Images/Stock images [closed]/Energy Use/heating-systems/Room Heaters/gas convector.jpg"
"Gas_Bill.jpg","processed/Gas_Bill.jpg","white, text, drawing, font, sketch, /m/02csf, meter, illustrations and icons, illustrations from previous projects, ian smith illustrations","thumbnails/Gas_Bill.jpg","S:/Comms/Images/Stock images [closed]/Illustrations and icons/illustrations from previous projects/Ian Smith illustrations/Gas_Bill.jpg"
"gas_bill_mono.jpg","processed/gas_bill_mono.jpg","white, text, drawing, font, sketch, /m/02csf, meter, illustrations and icons, illustrations from previous projects, ian smith illustrations","thumbnails/gas_bill_mono.jpg","S:/Comms/Images/Stock images [closed]/Illustrations and icons/illustrations from previous projects/Ian Smith illustrations/gas_bill_mono.jpg"
"gas_bill_mono.tif","processed/gas_bill_mono.tif","white, text, drawing, font, sketch, illustration, art, clip art, line art, illustrations and icons, illustrations from previous projects, ian smith illustrations","thumbnails/gas_bill_mono.tif","S:/Comms/Images/Stock images [closed]/Illustrations and icons/illustrations from previous projects/Ian Smith illustrations/gas_bill_mono.tif"
"general view.JPG","processed/general view.JPG","paint, building material, plaster, window, insulation, solid wall, mark's house - internal insulation- kingspan stage","thumbnails/general view.JPG","S:/Comms/Images/Stock images [closed]/Insulation/Solid Wall/Mark's house - internal insulation- kingspan stage/general view.JPG"
"GettyImages_165527993.jpg","processed/GettyImages_165527993.jpg","high-visibility clothing, personal protective equipment, workwear, jacket, blue-collar worker, biodiversity net gain, left, biodiversity, grassland, crop, person, pants, helmet, outerwear, NA","thumbnails/GettyImages_165527993.jpg",NA
"gloves_cut-out.png","processed/gloves_cut-out.png","wool, safety glove, woolen, glove, stock photography, istock, image, photography, objects, diy","thumbnails/gloves_cut-out.png","S:/Comms/Images/Stock images [closed]/Objects/DIY/gloves_cut-out.png"
"Green Doors solid wall 3 homes clad panoramic_small.jpg","processed/Green Doors solid wall 3 homes clad panoramic_small.jpg","scaffolding, metal, construction, building material, daylighting, apartment, housing, house, window, insulation, solid wall","thumbnails/Green Doors solid wall 3 homes clad panoramic_small.jpg","S:/Comms/Images/Stock images [closed]/Insulation/Solid Wall/Green Doors solid wall 3 homes clad panoramic_small.jpg"
"Green_roof_box_DW.jpg","processed/Green_roof_box_DW.jpg","grey, glass, daylighting, molding, building material, window, architecture, building, sash window, siding, insulation, roof","thumbnails/Green_roof_box_DW.jpg","S:/Comms/Images/Stock images [closed]/Insulation/roof/Green_roof_box_DW.jpg"
"greenhouse 008.jpg","processed/greenhouse 008.jpg","branch, daytime, twig, yellow, sunlight, tree, nature, plants","thumbnails/greenhouse 008.jpg","S:/Comms/Images/Stock images [closed]/nature/Plants/greenhouse 008.jpg"
"halogen-light-bulb.jpg","processed/halogen-light-bulb.jpg","incandescent light bulb, fluorescent lamp, halogen lamp, light, 2700 k, light bulb, lighting, energy use, bulbs","thumbnails/halogen-light-bulb.jpg","S:/Comms/Images/Stock images [closed]/Energy Use/lighting/bulbs/halogen-light-bulb.jpg"
"hammer cut-out.tif","processed/hammer cut-out.tif","metalworking hand tool, hammer, hand tool, tool, household hardware, framing hammer, geologist's hammer, stonemason's hammer, garden tool, objects, diy","thumbnails/hammer cut-out.tif","S:/Comms/Images/Stock images [closed]/Objects/DIY/hammer cut-out.tif"
"Hammer flat CMYK.tif","processed/Hammer flat CMYK.tif","metalworking hand tool, hammer, hand tool, household hardware, claw hammer, framing hammer, geologist's hammer, stonemason's hammer, cleaving axe, splitting maul, objects, diy","thumbnails/Hammer flat CMYK.tif","S:/Comms/Images/Stock images [closed]/Objects/DIY/Hammer flat CMYK.tif"
"happy man.jpg","processed/happy man.jpg","facial expression, orange, drawing, illustration, child art, painting, visual arts, art, watercolor painting, paint, illustrations and icons, illustrations from previous projects, healthy living scheme","thumbnails/happy man.jpg","S:/Comms/Images/Stock images [closed]/Illustrations and icons/illustrations from previous projects/Healthy Living scheme/happy man.jpg"
"hard_hat_iStock_15445841.jpg","processed/hard_hat_iStock_15445841.jpg","yellow, hard hat, personal protective equipment, helmet, chinstrap, hat, white safety helmet, objects, diy","thumbnails/hard_hat_iStock_15445841.jpg","S:/Comms/Images/Stock images [closed]/Objects/DIY/hard_hat_iStock_15445841.jpg"
"High res - Verity's house stock shots (10).jpg","processed/High res - Verity's house stock shots (10).jpg","ceiling, wood stain, hardwood, molding, varnish, sash window, insulation, loft, loft hatch","thumbnails/High res - Verity's house stock shots (10).jpg","S:/Comms/Images/Stock images [closed]/Insulation/Loft/loft hatch/High res - Verity's house stock shots (10).jpg"
"High res - Verity's house stock shots (11).jpg","processed/High res - Verity's house stock shots (11).jpg","hardwood, wood stain, fur, wood flooring, plywood, room, window, insulation, loft, loft hatch","thumbnails/High res - Verity's house stock shots (11).jpg","S:/Comms/Images/Stock images [closed]/Insulation/Loft/loft hatch/High res - Verity's house stock shots (11).jpg"
"High res - Verity's house stock shots (12).jpg","processed/High res - Verity's house stock shots (12).jpg","wood, floor, hardwood, wood stain, molding, sash window, room, insulation, loft, loft hatch","thumbnails/High res - Verity's house stock shots (12).jpg","S:/Comms/Images/Stock images [closed]/Insulation/Loft/loft hatch/High res - Verity's house stock shots (12).jpg"
"High res - Verity's house stock shots (9).jpg","processed/High res - Verity's house stock shots (9).jpg","wood, flooring, floor, ceiling, wood stain, room, bag, insulation, loft, loft hatch","thumbnails/High res - Verity's house stock shots (9).jpg","S:/Comms/Images/Stock images [closed]/Insulation/Loft/loft hatch/High res - Verity's house stock shots (9).jpg"
"holding a thermal camera.png","processed/holding a thermal camera.png","electronic device, gadget, mobile phone, smartphone, mobile device, stock footage, footage, thermography, camera, royalty-free, clothing, insulation, thermal imaging","thumbnails/holding a thermal camera.png","S:/Comms/Images/Stock images [closed]/Insulation/thermal imaging/holding a thermal camera.png"
"hot water tank insulated crop.jpg","processed/hot water tank insulated crop.jpg","red, hose, electrical cable, pipe, plastic, water, water storage, hot water storage tank, water tank, water heating, backpack, insulation, hot water tank jacket","thumbnails/hot water tank insulated crop.jpg","S:/Comms/Images/Stock images [closed]/Insulation/hot water tank jacket/hot water tank insulated crop.jpg"
"hot water tank insulated.jpg","processed/hot water tank insulated.jpg","pipe, electrical cable, machine, hose, plumbing, water, hot water storage tank, water heating, water tank, thermal insulation, backpack, luggage & bags, insulation, hot water tank jacket","thumbnails/hot water tank insulated.jpg","S:/Comms/Images/Stock images [closed]/Insulation/hot water tank jacket/hot water tank insulated.jpg"
"hot_parade.jpg","processed/hot_parade.jpg","electronic device, technology, home appliance, machine, air purifier, heating system, heat, natural gas, energy, space heater, energy use, heating-systems, room heaters","thumbnails/hot_parade.jpg","S:/Comms/Images/Stock images [closed]/Energy Use/heating-systems/Room Heaters/hot_parade.jpg"
"house.jpg","processed/house.jpg","white, line art, coloring book, illustration, clip art, image, cartoon, interior design, illustrations and icons","thumbnails/house.jpg","S:/Comms/Images/Stock images [closed]/Illustrations and icons/house.jpg"
"house_sept_2012 022.jpg","processed/house_sept_2012 022.jpg","wood, attic, hardwood, beam, ceiling, loft conversions in the united kingdom, window, ventilation, insulation, wall, person, top, pants, loft","thumbnails/house_sept_2012 022.jpg","S:/Comms/Images/Stock images [closed]/Insulation/Loft/house_sept_2012 022.jpg"
"IKEA lightbulb.jpg","processed/IKEA lightbulb.jpg","light bulb, fluorescent lamp, incandescent light bulb, compact fluorescent lamp, sphere, light-emitting diode, light, diode, energy use, lighting, bulbs","thumbnails/IKEA lightbulb.jpg","S:/Comms/Images/Stock images [closed]/Energy Use/lighting/bulbs/IKEA lightbulb.jpg"
"image015.jpg","processed/image015.jpg","wood-burning stove, stove, gas stove, fireplace, hearth, energy use, heating-systems, room heaters","thumbnails/image015.jpg","S:/Comms/Images/Stock images [closed]/Energy Use/heating-systems/Room Heaters/image015.jpg"
"images.jpeg","processed/images.jpeg","flooring, hardwood, wood flooring, electric heating, home appliance, energy use, heating-systems, room heaters","thumbnails/images.jpeg","S:/Comms/Images/Stock images [closed]/Energy Use/heating-systems/Room Heaters/images.jpeg"
"IMG_0020.JPG","processed/IMG_0020.JPG","plastic, houseplant, herb, passion flowers, insulation, solid wall, bridgets house","thumbnails/IMG_0020.JPG","S:/Comms/Images/Stock images [closed]/Insulation/Solid Wall/bridgets house/IMG_0020.JPG"
"IMG_0022.JPG","processed/IMG_0022.JPG","tv, television, y3w, insulation, solid wall, bridgets house","thumbnails/IMG_0022.JPG","S:/Comms/Images/Stock images [closed]/Insulation/Solid Wall/bridgets house/IMG_0022.JPG"
"IMG_0028.JPG","processed/IMG_0028.JPG","daylighting, plaster, architecture, window, house, insulation, solid wall, bridgets house","thumbnails/IMG_0028.JPG","S:/Comms/Images/Stock images [closed]/Insulation/Solid Wall/bridgets house/IMG_0028.JPG"
"IMG_0299.JPG","processed/IMG_0299.JPG","wood, floor, hardwood, composite material, plank, aegean cat, /m/083vt, moggy, aegean sea, insulation, cat and joists","thumbnails/IMG_0299.JPG","S:/Comms/Images/Stock images [closed]/Insulation/floor/cat and joists/IMG_0299.JPG"
"IMG_0300.JPG","processed/IMG_0300.JPG","cat, wood, felidae, floor, flooring, /m/083vt, animal, insulation, cat and joists","thumbnails/IMG_0300.JPG","S:/Comms/Images/Stock images [closed]/Insulation/floor/cat and joists/IMG_0300.JPG"
"IMG_0301.JPG","processed/IMG_0301.JPG","cat, felidae, wood, felinae, vertebrate, /m/083vt, jean sport aviation center, calf, storey, dog, door, animal, insulation, floor, cat and joists","thumbnails/IMG_0301.JPG","S:/Comms/Images/Stock images [closed]/Insulation/floor/cat and joists/IMG_0301.JPG"
"IMG_0305.JPG","processed/IMG_0305.JPG","flooring, wood flooring, floor, wood, furniture, table, laminate flooring, plywood, handbag, bag, insulation","thumbnails/IMG_0305.JPG","S:/Comms/Images/Stock images [closed]/Insulation/floor/IMG_0305.JPG"
"IMG_0306.JPG","processed/IMG_0306.JPG","flooring, floor, wood, wood flooring, hardwood, jean sport aviation center, insulation","thumbnails/IMG_0306.JPG","S:/Comms/Images/Stock images [closed]/Insulation/floor/IMG_0306.JPG"
"IMG_0307.JPG","processed/IMG_0307.JPG","flooring, floor, wood, wood flooring, hardwood, plywood, tile, jean sport aviation center, insulation","thumbnails/IMG_0307.JPG","S:/Comms/Images/Stock images [closed]/Insulation/floor/IMG_0307.JPG"
"IMG_0308.JPG","processed/IMG_0308.JPG","flooring, wood, floor, wood flooring, hardwood, plywood, insulation","thumbnails/IMG_0308.JPG","S:/Comms/Images/Stock images [closed]/Insulation/floor/IMG_0308.JPG"
"IMG_0355.JPG","processed/IMG_0355.JPG","scaffolding, suv, mitsubishi toppo, mitsubishi motors, minivan, construction, car, insulation, solid wall, montpelier june 2015","thumbnails/IMG_0355.JPG","S:/Comms/Images/Stock images [closed]/Insulation/Solid Wall/montpelier june 2015/IMG_0355.JPG"
"IMG_0356.JPG","processed/IMG_0356.JPG","scaffolding, construction, building material, car, executive car, architecture, apartment, insulation, solid wall, montpelier june 2015","thumbnails/IMG_0356.JPG","S:/Comms/Images/Stock images [closed]/Insulation/Solid Wall/montpelier june 2015/IMG_0356.JPG"
"IMG_0358.JPG","processed/IMG_0358.JPG","scaffolding, construction, building material, window, daylighting, sash window, architecture, apartment, insulation, solid wall, montpelier june 2015","thumbnails/IMG_0358.JPG","S:/Comms/Images/Stock images [closed]/Insulation/Solid Wall/montpelier june 2015/IMG_0358.JPG"
"IMG_0377.JPG","processed/IMG_0377.JPG","scaffolding, construction, building material, roofer, roof, architecture, insulation, solid wall, montpelier june 2015","thumbnails/IMG_0377.JPG","S:/Comms/Images/Stock images [closed]/Insulation/Solid Wall/montpelier june 2015/IMG_0377.JPG"
"IMG_0390.JPG","processed/IMG_0390.JPG","scaffolding, construction, engineering, building material, steel, centre for sustainable energy, the queen's college, house, NA, efficient energy use, person, insulation, solid wall, montpelier june 2015","thumbnails/IMG_0390.JPG","S:/Comms/Images/Stock images [closed]/Insulation/Solid Wall/montpelier june 2015/IMG_0390.JPG"
"IMG_0536.JPG","processed/IMG_0536.JPG","plastic, packaging and labeling, box, office supplies, label, 1d barcode, energy use, lighting, bulbs","thumbnails/IMG_0536.JPG","S:/Comms/Images/Stock images [closed]/Energy Use/lighting/bulbs/IMG_0536.JPG"
"IMG_0538.JPG","processed/IMG_0538.JPG","plastic, packaging and labeling, box, label, office supplies, carton, energy use, lighting, bulbs","thumbnails/IMG_0538.JPG","S:/Comms/Images/Stock images [closed]/Energy Use/lighting/bulbs/IMG_0538.JPG"
"IMG_0540.JPG","processed/IMG_0540.JPG","technology, compact fluorescent lamp, fluorescent lamp, plastic, 1d barcode, energy use, lighting, bulbs","thumbnails/IMG_0540.JPG","S:/Comms/Images/Stock images [closed]/Energy Use/lighting/bulbs/IMG_0540.JPG"
"IMG_0635.JPG","processed/IMG_0635.JPG","map, urban design, plan, technology, atlas, tuberculosis, maps","thumbnails/IMG_0635.JPG","S:/Comms/Images/Stock images [closed]/maps/IMG_0635.JPG"
"IMG_0636.JPG","processed/IMG_0636.JPG","map, plan, design, screenshot, atlas, tuberculosis, maps","thumbnails/IMG_0636.JPG","S:/Comms/Images/Stock images [closed]/maps/IMG_0636.JPG"
"IMG_2554.jpg","processed/IMG_2554.jpg","flower, plants, flowering plant, prairie, herbaceous plant, cow parsley, umbellifers, water-hemlock, yarrow, sweet grass, nature","thumbnails/IMG_2554.jpg","S:/Comms/Images/Stock images [closed]/nature/Plants/IMG_2554.jpg"
"IMG_2645.jpg","processed/IMG_2645.jpg","sky, cloud, blue, daytime, cumulus, nature","thumbnails/IMG_2645.jpg","S:/Comms/Images/Stock images [closed]/nature/Sky/IMG_2645.jpg"
"IMG_2661.jpg","processed/IMG_2661.jpg","shrub, garden, groundcover, purple, herbaceous plant, fernleaf lavender, french lavender, english lavender, delphinium, nature, plants","thumbnails/IMG_2661.jpg","S:/Comms/Images/Stock images [closed]/nature/Plants/IMG_2661.jpg"
"IMG_2662.jpg","processed/IMG_2662.jpg","flower, green, plants, groundcover, garden, english lavender, lemon beebalm, fernleaf lavender, lobelias, vervain, nature","thumbnails/IMG_2662.jpg","S:/Comms/Images/Stock images [closed]/nature/Plants/IMG_2662.jpg"
