"filename","image_path","tags","thumbnail_path","original_filepath"
"Sigmund-Unsplash (2).jpg","processed/Sigmund-Unsplash (2).jpg","monochrome photography, monochrome, composite material, pipe, black and white, heating, ventilation, and air conditioning, heating system, plumbing, air conditioning, energy supply, district heating","thumbnails/Sigmund-Unsplash (2).jpg","S:/Comms/Images/Stock images [closed]/Energy Supply/district heating/Sigmund-Unsplash (2).jpg"
"Sigmund-Unsplash (3).jpg","processed/Sigmund-Unsplash (3).jpg","pipe, composite material, metal, pipeline transport, iron, crawl space, water pipe, central heating, heating system, energy supply, district heating","thumbnails/Sigmund-Unsplash (3).jpg","S:/Comms/Images/Stock images [closed]/Energy Supply/district heating/Sigmund-Unsplash (3).jpg"
"Site photo.jpg","processed/Site photo.jpg","house, residential area, roof, home, neighbourhood, rural area, suburb, village-m, cottage m, van, energy supply, solar pv, st werburghs","thumbnails/Site photo.jpg","S:/Comms/Images/Stock images [closed]/Energy Supply/Solar PV/St Werburghs/Site photo.jpg"
"Sloman - hybrid.JPG","processed/Sloman - hybrid.JPG","home, solar panel, sash window, solar energy, daylighting, window, property, architecture, north american fraternity and sorority housing, house, energy supply, solar pv, 1 world solar","thumbnails/Sloman - hybrid.JPG","S:/Comms/Images/Stock images [closed]/Energy Supply/Solar PV/1 world solar/Sloman - hybrid.JPG"
"Slotting-Tube.jpg","processed/Slotting-Tube.jpg","roof, composite material, roofer, brickwork, building material, construction, construction worker, person, clothing, top, energy supply, solar thermal, matthews pics","thumbnails/Slotting-Tube.jpg","S:/Comms/Images/Stock images [closed]/Energy Supply/Solar Thermal/Matthews pics/Slotting-Tube.jpg"
"slow cooker Jerry Pank.jpg","processed/slow cooker Jerry Pank.jpg","cookware and bakeware, slow cooker, food, morphy richards, morphy richards 48715a oval slow cooker, 6.5l - silver, pressure cooker, range, home appliance, energy use, cooking","thumbnails/slow cooker Jerry Pank.jpg","S:/Comms/Images/Stock images [closed]/Energy Use/Cooking/slow cooker Jerry Pank.jpg"
"smallgroup.jpg","processed/smallgroup.jpg","wind turbine, windmill, wind farm, community, social group, turbine, wind, person, energy supply, avonmouth, triodos open day at avonmouth","thumbnails/smallgroup.jpg","S:/Comms/Images/Stock images [closed]/Energy Supply/Wind/avonmouth/triodos open day at avonmouth/smallgroup.jpg"
"smart-meter-bg.jpg","processed/smart-meter-bg.jpg","electronic device, display device, gadget, electronics, technology, smart meter, energy, electricity, na, british gas, energy use, energy monitors, meters & bills, smart meters, energy monitors, meters & bills","thumbnails/smart-meter-bg.jpg","S:/Comms/Images/Stock images [closed]/Energy Use/Energy Monitors, Meters & Bills/smart meters/smart-meter-bg.jpg"
"smart-meter-photo.JPG","processed/smart-meter-photo.JPG","number, clock, smart grid, smart meter, electricity, electricity meter, public utility, 1d barcode, energy use, energy monitors, meters & bills, smart meters, energy monitors, meters & bills","thumbnails/smart-meter-photo.JPG","S:/Comms/Images/Stock images [closed]/Energy Use/Energy Monitors, Meters & Bills/smart meters/smart-meter-photo.JPG"
"smart energy meter copy.jpg","processed/smart energy meter copy.jpg","display device, electronic device, technology, electronics, measuring instrument, tablet, computer, energy use, energy monitors, meters & bills, smart meters, energy monitors, meters & bills","thumbnails/smart energy meter copy.jpg","S:/Comms/Images/Stock images [closed]/Energy Use/Energy Monitors, Meters & Bills/smart meters/smart energy meter copy.jpg"
"smart energy meter.png","processed/smart energy meter.png","electronic device, display device, technology, electronics, gadget, smart meter, electricity, energy, energy consumption, electric energy consumption, energy use, energy monitors, meters & bills, smart meters, energy monitors, meters & bills","thumbnails/smart energy meter.png","S:/Comms/Images/Stock images [closed]/Energy Use/Energy Monitors, Meters & Bills/smart meters/smart energy meter.png"
"smart meter 1 Josephine Thomas.JPG","processed/smart meter 1 Josephine Thomas.JPG","measuring instrument, electricity meter, electricity, israel electric corporation, smart meter, electricity authority, energy use, energy monitors, meters & bills, smart meters, energy monitors, meters & bills","thumbnails/smart meter 1 Josephine Thomas.JPG","S:/Comms/Images/Stock images [closed]/Energy Use/Energy Monitors, Meters & Bills/smart meters/smart meter 1 Josephine Thomas.JPG"
"socket timer.jpg","processed/socket timer.jpg","electronic device, watch, technology, measuring instrument, number, time switch, switch, timer, electronics, time, energy use, electric sockets, plugs etc, electric sockets, plugs etc","thumbnails/socket timer.jpg","S:/Comms/Images/Stock images [closed]/Energy Use/electric sockets, plugs etc/socket timer.jpg"
"solar 0073 EST.JPG","processed/solar 0073 EST.JPG","solar energy, solar panel, solar power, technology, solar thermal collector, community solar, sustainable energy, energy, energy supply, solar pv","thumbnails/solar 0073 EST.JPG","S:/Comms/Images/Stock images [closed]/Energy Supply/Solar PV/solar 0073 EST.JPG"
"solar inverter.jpg","processed/solar inverter.jpg","electronic device, technology, machine, room, energy supply, solar pv","thumbnails/solar inverter.jpg","S:/Comms/Images/Stock images [closed]/Energy Supply/Solar PV/solar inverter.jpg"
"solar on victoria park church.JPG","processed/solar on victoria park church.JPG","brickwork, car, suv, north american fraternity and sorority housing, listed building, compact mpv, window, energy supply, solar pv","thumbnails/solar on victoria park church.JPG","S:/Comms/Images/Stock images [closed]/Energy Supply/Solar PV/solar on victoria park church.JPG"
"solar panel.tif","processed/solar panel.tif","metal, daylighting, solar energy, solar panel, design, roof, pembrokeshire coast national park, pembrokeshire, renewable energy, building, energy supply, solar thermal","thumbnails/solar panel.tif","S:/Comms/Images/Stock images [closed]/Energy Supply/Solar Thermal/solar panel.tif"
"solar panels Create kitchen.JPG","processed/solar panels Create kitchen.JPG","high-visibility clothing, workwear, brickwork, hard hat, blue-collar worker, façade, person, top, clothing, energy supply, solar pv, 1 world solar","thumbnails/solar panels Create kitchen.JPG","S:/Comms/Images/Stock images [closed]/Energy Supply/Solar PV/1 world solar/solar panels Create kitchen.JPG"
"solar PV installers iStock.jpg","processed/solar PV installers iStock.jpg","solar energy, solar panel, solar power, engineer, solar thermal collector, electricity, photovoltaic system, photovoltaics, electrician, person, top, jeans, energy supply, solar pv","thumbnails/solar PV installers iStock.jpg","S:/Comms/Images/Stock images [closed]/Energy Supply/Solar PV/solar PV installers iStock.jpg"
"solar tiles 003.jpg","processed/solar tiles 003.jpg","wood, composite material, siding, plank, building material, log cabin, roof, barn, shed, energy supply, solar pv, solar tiles - brockweir","thumbnails/solar tiles 003.jpg","S:/Comms/Images/Stock images [closed]/Energy Supply/Solar PV/solar tiles - brockweir/solar tiles 003.jpg"
"solar tiles 004.jpg","processed/solar tiles 004.jpg","wood, composite material, glass, siding, plank, roof, daylighting, cottage m, shed, window, house, energy supply, solar pv, solar tiles - brockweir","thumbnails/solar tiles 004.jpg","S:/Comms/Images/Stock images [closed]/Energy Supply/Solar PV/solar tiles - brockweir/solar tiles 004.jpg"
"solar tiles 006.jpg","processed/solar tiles 006.jpg","roof, composite material, brickwork, building material, daylighting, architecture, house, light fixture, energy supply, solar pv, solar tiles - brockweir","thumbnails/solar tiles 006.jpg","S:/Comms/Images/Stock images [closed]/Energy Supply/Solar PV/solar tiles - brockweir/solar tiles 006.jpg"
"solar tiles 008.jpg","processed/solar tiles 008.jpg","roof, solar energy, composite material, solar panel, solar power, daylighting, architecture, barn, house, energy supply, solar pv, solar tiles - brockweir","thumbnails/solar tiles 008.jpg","S:/Comms/Images/Stock images [closed]/Energy Supply/Solar PV/solar tiles - brockweir/solar tiles 008.jpg"
"solar tiles 009.jpg","processed/solar tiles 009.jpg","wood, composite material, siding, hardwood, building material, shed, outhouse, roof, barn, cottage m, energy supply, solar pv, solar tiles - brockweir","thumbnails/solar tiles 009.jpg","S:/Comms/Images/Stock images [closed]/Energy Supply/Solar PV/solar tiles - brockweir/solar tiles 009.jpg"
"solar tiles 011.jpg","processed/solar tiles 011.jpg","grey, siding, energy supply, solar pv, solar tiles - brockweir","thumbnails/solar tiles 011.jpg","S:/Comms/Images/Stock images [closed]/Energy Supply/Solar PV/solar tiles - brockweir/solar tiles 011.jpg"
"solar tiles 016.jpg","processed/solar tiles 016.jpg","cottage, siding, shed, lumber, suv, minivan, ford, compact car, ford motor company, car, energy supply, solar pv, solar tiles - brockweir","thumbnails/solar tiles 016.jpg","S:/Comms/Images/Stock images [closed]/Energy Supply/Solar PV/solar tiles - brockweir/solar tiles 016.jpg"
"solar tiles 017.jpg","processed/solar tiles 017.jpg","daytime, wall, wood, composite material, iron, apartment, high-rise building, architecture, tower, tree, energy supply, solar pv, solar tiles - brockweir","thumbnails/solar tiles 017.jpg","S:/Comms/Images/Stock images [closed]/Energy Supply/Solar PV/solar tiles - brockweir/solar tiles 017.jpg"
"solar tiles 018.jpg","processed/solar tiles 018.jpg","wood, composite material, hardwood, plank, wood stain, window, screen door, sash window, door, roof, energy supply, solar pv, solar tiles - brockweir","thumbnails/solar tiles 018.jpg","S:/Comms/Images/Stock images [closed]/Energy Supply/Solar PV/solar tiles - brockweir/solar tiles 018.jpg"
"solar tiles brockweir shop.jpg","processed/solar tiles brockweir shop.jpg","wood, composite material, door, siding, hardwood, window, roof, daylighting, sash window, shed, energy supply, solar pv, solar tiles - brockweir","thumbnails/solar tiles brockweir shop.jpg","S:/Comms/Images/Stock images [closed]/Energy Supply/Solar PV/solar tiles - brockweir/solar tiles brockweir shop.jpg"
"solar_rural_2.jpg","processed/solar_rural_2.jpg","shrub, house, cottage, home, brick, window, m-049, sash window, roof, farmhouse, plant, energy supply, solar thermal","thumbnails/solar_rural_2.jpg","S:/Comms/Images/Stock images [closed]/Energy Supply/Solar Thermal/solar_rural_2.jpg"
"solar_rural_3.jpg","processed/solar_rural_3.jpg","house, shrub, roof, cottage, home, rural area, tree, cottage m, village-m, window, plant, energy supply, solar thermal","thumbnails/solar_rural_3.jpg","S:/Comms/Images/Stock images [closed]/Energy Supply/Solar Thermal/solar_rural_3.jpg"
"solar_thermal_eco_house.jpg","processed/solar_thermal_eco_house.jpg","pipe, grey, building material, chimney, roof, plank, energy supply, solar thermal","thumbnails/solar_thermal_eco_house.jpg","S:/Comms/Images/Stock images [closed]/Energy Supply/Solar Thermal/solar_thermal_eco_house.jpg"
"solid brick wall 1.jpg","processed/solid brick wall 1.jpg","red, brick, pink, brickwork, brown, wall, cavity wall, insulation, buildings (general), wall types","thumbnails/solid brick wall 1.jpg","S:/Comms/Images/Stock images [closed]/Buildings (general)/wall types/solid brick wall 1.jpg"
"solid brick wall 2.jpg","processed/solid brick wall 2.jpg","red, brick, pink, brown, orange, brickwork, buildings (general), wall types","thumbnails/solid brick wall 2.jpg","S:/Comms/Images/Stock images [closed]/Buildings (general)/wall types/solid brick wall 2.jpg"
"south_bris_sports_centre_BEC.JPG","processed/south_bris_sports_centre_BEC.JPG","solar energy, solar panel, solar power, technology, solar thermal collector, sunlight, energy supply, solar pv","thumbnails/south_bris_sports_centre_BEC.JPG","S:/Comms/Images/Stock images [closed]/Energy Supply/Solar PV/south_bris_sports_centre_BEC.JPG"
"south_bris_sports_centre_BEC_crop.jpg","processed/south_bris_sports_centre_BEC_crop.jpg","solar energy, solar panel, solar power, technology, daylighting, roof, sunlight, building, energy supply, solar pv","thumbnails/south_bris_sports_centre_BEC_crop.jpg","S:/Comms/Images/Stock images [closed]/Energy Supply/Solar PV/south_bris_sports_centre_BEC_crop.jpg"
"southernelectric-viewbill-2-1.png","processed/southernelectric-viewbill-2-1.png","font, screenshot, label, na, sse plc, electricity, electric bill, electrical energy, energy use, energy monitors, meters & bills, paper bills, energy monitors, meters & bills","thumbnails/southernelectric-viewbill-2-1.png","S:/Comms/Images/Stock images [closed]/Energy Use/Energy Monitors, Meters & Bills/paper bills/southernelectric-viewbill-2-1.png"
"St Werburghs Self Build Site 010.jpg","processed/St Werburghs Self Build Site 010.jpg","solar energy, solar panel, solar power, roof, solar thermal collector, daylighting, cottage m, shed, house, window, energy supply, solar pv, st werburghs","thumbnails/St Werburghs Self Build Site 010.jpg","S:/Comms/Images/Stock images [closed]/Energy Supply/Solar PV/St Werburghs/St Werburghs Self Build Site 010.jpg"
"St Werburghs Self Build Site 011 small.jpg","processed/St Werburghs Self Build Site 011 small.jpg","solar energy, solar power, solar panel, solar thermal collector, siding, heat pump, water, heat, heating, ventilation, and air conditioning, pump, energy supply, solar pv, st werburghs","thumbnails/St Werburghs Self Build Site 011 small.jpg","S:/Comms/Images/Stock images [closed]/Energy Supply/Solar PV/St Werburghs/St Werburghs Self Build Site 011 small.jpg"
"St Werburghs Self Build Site 011.jpg","processed/St Werburghs Self Build Site 011.jpg","roof, home, solar energy, solar power, cottage, solar wizard, bristol 24/7, house, cottage m, energy supply, solar pv, st werburghs","thumbnails/St Werburghs Self Build Site 011.jpg","S:/Comms/Images/Stock images [closed]/Energy Supply/Solar PV/St Werburghs/St Werburghs Self Build Site 011.jpg"
"stacked timber1.jpg","processed/stacked timber1.jpg","logging, wood, trunk, forest, lumber, tree, energy supply, biomass, timber","thumbnails/stacked timber1.jpg","S:/Comms/Images/Stock images [closed]/Energy Supply/Biomass/timber/stacked timber1.jpg"
"stacked timber2.jpg","processed/stacked timber2.jpg","logging, wood, trunk, woody plant, forest, tree stump, tree, lumber, grass, energy supply, biomass, timber","thumbnails/stacked timber2.jpg","S:/Comms/Images/Stock images [closed]/Energy Supply/Biomass/timber/stacked timber2.jpg"
"stacked timber3.jpg","processed/stacked timber3.jpg","wood, logging, natural material, hardwood, lumber, energy supply, biomass, timber","thumbnails/stacked timber3.jpg","S:/Comms/Images/Stock images [closed]/Energy Supply/Biomass/timber/stacked timber3.jpg"
"stacked timber7.jpg","processed/stacked timber7.jpg","logging, wood, hardwood, natural material, lumber, pond pine, mexican pinyon, tree stump, energy supply, biomass, timber","thumbnails/stacked timber7.jpg","S:/Comms/Images/Stock images [closed]/Energy Supply/Biomass/timber/stacked timber7.jpg"
"stacked timber8.jpg","processed/stacked timber8.jpg","logging, wood, trunk, hardwood, natural material, lumber, tree stump, tree, energy supply, biomass, timber","thumbnails/stacked timber8.jpg","S:/Comms/Images/Stock images [closed]/Energy Supply/Biomass/timber/stacked timber8.jpg"
"stacked timber9.jpg","processed/stacked timber9.jpg","logging, wood, hardwood, natural material, lumber, tree, energy supply, biomass, timber","thumbnails/stacked timber9.jpg","S:/Comms/Images/Stock images [closed]/Energy Supply/Biomass/timber/stacked timber9.jpg"
"stacked_roundwood.jpg","processed/stacked_roundwood.jpg","logging, wood, trunk, forest, lumber, tree, energy supply, biomass, timber","thumbnails/stacked_roundwood.jpg","S:/Comms/Images/Stock images [closed]/Energy Supply/Biomass/timber/stacked_roundwood.jpg"
"stacked_roundwood2.jpg","processed/stacked_roundwood2.jpg","wood, logging, trunk, woodland, plantation, tree, lumber, botanical garden, energy supply, biomass, timber","thumbnails/stacked_roundwood2.jpg","S:/Comms/Images/Stock images [closed]/Energy Supply/Biomass/timber/stacked_roundwood2.jpg"
"stacked_roundwood3.jpg","processed/stacked_roundwood3.jpg","wood, logging, trunk, forest, woodland, grass, tree, lumber, energy supply, biomass, timber","thumbnails/stacked_roundwood3.jpg","S:/Comms/Images/Stock images [closed]/Energy Supply/Biomass/timber/stacked_roundwood3.jpg"
"standby button - 3406200523 - smig44_uk.jpg","processed/standby button - 3406200523 - smig44_uk.jpg","electronic device, technology, gadget, loudspeaker, carbon fibers, neon, energy use, appliances","thumbnails/standby button - 3406200523 - smig44_uk.jpg","S:/Comms/Images/Stock images [closed]/Energy Use/Appliances/standby button - 3406200523 - smig44_uk.jpg"
"Sterebel Eltron.JPG","processed/Sterebel Eltron.JPG","solar energy, solar panel, solar power, composite material, daylighting, roof, tree, energy supply, solar pv, 1 world solar","thumbnails/Sterebel Eltron.JPG","S:/Comms/Images/Stock images [closed]/Energy Supply/Solar PV/1 world solar/Sterebel Eltron.JPG"
"stone wall 1.jpg","processed/stone wall 1.jpg","brick, close-up, brickwork, stone wall, building material, stone, buildings (general), wall types","thumbnails/stone wall 1.jpg","S:/Comms/Images/Stock images [closed]/Buildings (general)/wall types/stone wall 1.jpg"
"stone wall 2.jpg","processed/stone wall 2.jpg","brown, brick, close-up, stone wall, brickwork, buildings (general), wall types","thumbnails/stone wall 2.jpg","S:/Comms/Images/Stock images [closed]/Buildings (general)/wall types/stone wall 2.jpg"
"storage heater controls.jpg","processed/storage heater controls.jpg","electronic device, machine, home appliance, plastic, air purifier, storage heater, electric heating, electricity, radiator, heat, energy use, heating-systems, heating controls","thumbnails/storage heater controls.jpg","S:/Comms/Images/Stock images [closed]/Energy Use/heating-systems/Heating Controls/storage heater controls.jpg"
"storage heater controls_cropped.jpg","processed/storage heater controls_cropped.jpg","electronic device, home appliance, machine, plastic, air purifier, storage heater, electric heating, electricity, radiator, boiler, energy use, heating-systems, heating controls","thumbnails/storage heater controls_cropped.jpg","S:/Comms/Images/Stock images [closed]/Energy Use/heating-systems/Heating Controls/storage heater controls_cropped.jpg"
"Sunny face.jpg","processed/Sunny face.jpg","fun, leisure, child, light-hearted, person, clothing, top, energy supply, solar pv, plymouth community energy","thumbnails/Sunny face.jpg","S:/Comms/Images/Stock images [closed]/Energy Supply/Solar PV/Plymouth Community Energy/Sunny face.jpg"
"Tank.jpg","processed/Tank.jpg","pipe, machine, cylinder, electrical cable, hardwood, plywood, room, punching bag, chair, furniture, energy supply, solar thermal, matthews pics","thumbnails/Tank.jpg","S:/Comms/Images/Stock images [closed]/Energy Supply/Solar Thermal/Matthews pics/Tank.jpg"
"tech_solar_baskingstoke_02.jpg","processed/tech_solar_baskingstoke_02.jpg","solar energy, solar panel, solar power, solar thermal collector, daylighting, avtofaraon, playground, makarska parking, staple, parking makarska, energy supply, solar pv, 1 world solar","thumbnails/tech_solar_baskingstoke_02.jpg","S:/Comms/Images/Stock images [closed]/Energy Supply/Solar PV/1 world solar/tech_solar_baskingstoke_02.jpg"
"tech_solar_baskingstoke_02_square.jpg","processed/tech_solar_baskingstoke_02_square.jpg","solar energy, solar panel, solar power, solar thermal collector, daylighting, renewable energy, energy, energy transition, house, energy supply, solar pv, 1 world solar","thumbnails/tech_solar_baskingstoke_02_square.jpg","S:/Comms/Images/Stock images [closed]/Energy Supply/Solar PV/1 world solar/tech_solar_baskingstoke_02_square.jpg"
"terraced_homes_bedminster1.jpg","processed/terraced_homes_bedminster1.jpg","door, sash window, sidewalk, subcompact car, listed building, car, apartment, property, neighbourhood, window, buildings (general), housing types, terraced housing","thumbnails/terraced_homes_bedminster1.jpg","S:/Comms/Images/Stock images [closed]/Buildings (general)/housing types/terraced housing/terraced_homes_bedminster1.jpg"
"terraced_homes_bedminster3.jpg","processed/terraced_homes_bedminster3.jpg","window, building, town, house, neighbourhood, car, street, apartment, person, clothing, buildings (general), housing types, terraced housing","thumbnails/terraced_homes_bedminster3.jpg","S:/Comms/Images/Stock images [closed]/Buildings (general)/housing types/terraced housing/terraced_homes_bedminster3.jpg"
"terraced_houses_totterdown1.JPG","processed/terraced_houses_totterdown1.JPG","daytime, wall, residential area, apartment, neighbourhood, suburb, tree, architecture, buildings (general), housing types, terraced housing","thumbnails/terraced_houses_totterdown1.JPG","S:/Comms/Images/Stock images [closed]/Buildings (general)/housing types/terraced housing/terraced_houses_totterdown1.JPG"
"terraced_houses_totterdown2.JPG","processed/terraced_houses_totterdown2.JPG","wall, residential area, neighbourhood, house, home, apartment, almshouse, tree, sash window, real estate, buildings (general), housing types, terraced housing","thumbnails/terraced_houses_totterdown2.JPG","S:/Comms/Images/Stock images [closed]/Buildings (general)/housing types/terraced housing/terraced_houses_totterdown2.JPG"
"Thermomax.JPG","processed/Thermomax.JPG","solar energy, solar panel, technology, solar power, solar thermal collector, energy, гелиоқондырғы, daylighting, roof, energy supply, solar pv, 1 world solar","thumbnails/Thermomax.JPG","S:/Comms/Images/Stock images [closed]/Energy Supply/Solar PV/1 world solar/Thermomax.JPG"
"Thomas.jpg","processed/Thomas.jpg","solar energy, solar panel, solar power, composite material, solar thermal collector, theory of relativity, photovoltaics, gravity, physics, energy, building, energy supply, solar pv, 1 world solar","thumbnails/Thomas.jpg","S:/Comms/Images/Stock images [closed]/Energy Supply/Solar PV/1 world solar/Thomas.jpg"
"Thrive-Renewables-March-June-2016-200-Edit (Medium) (4).jpg","processed/Thrive-Renewables-March-June-2016-200-Edit (Medium) (4).jpg","wind turbine, windmill, wind farm, social group, community, turbine, wind, person, top, energy supply, avonmouth, triodos open day at avonmouth","thumbnails/Thrive-Renewables-March-June-2016-200-Edit (Medium) (4).jpg","S:/Comms/Images/Stock images [closed]/Energy Supply/Wind/avonmouth/triodos open day at avonmouth/Thrive-Renewables-March-June-2016-200-Edit (Medium) (4).jpg"
"tiara-heating-controls-cut-out.jpg","processed/tiara-heating-controls-cut-out.jpg","electronic device, technology, electronics, machine, measuring instrument, water, boiler, wet, 07059, central heating, energy use, heating-systems, heating controls","thumbnails/tiara-heating-controls-cut-out.jpg","S:/Comms/Images/Stock images [closed]/Energy Use/heating-systems/Heating Controls/tiara-heating-controls-cut-out.jpg"
"tiara-heating-controls.jpg","processed/tiara-heating-controls.jpg","electronic device, technology, electronics, machine, measuring instrument, water, boiler, wet, central heating, kitchen, energy use, heating-systems, heating controls","thumbnails/tiara-heating-controls.jpg","S:/Comms/Images/Stock images [closed]/Energy Use/heating-systems/Heating Controls/tiara-heating-controls.jpg"
"timber.jpg","processed/timber.jpg","wood, logging, natural material, hardwood, lumber, tree, scrap, energy supply, biomass, timber","thumbnails/timber.jpg","S:/Comms/Images/Stock images [closed]/Energy Supply/Biomass/timber/timber.jpg"
"tour 3.jpg","processed/tour 3.jpg","solar energy, solar panel, solar power, recreation, people in nature, ernesettle, plymouth energy community, renewable energy, energy, pedernales electric, person, top, clothing, energy supply, solar pv, plymouth community energy","thumbnails/tour 3.jpg","S:/Comms/Images/Stock images [closed]/Energy Supply/Solar PV/Plymouth Community Energy/tour 3.jpg"
"Tube-in-Bracket.jpg","processed/Tube-in-Bracket.jpg","roof, roofer, brickwork, brick, building material, construction worker, construction, person, shorts, top, energy supply, solar thermal, matthews pics","thumbnails/Tube-in-Bracket.jpg","S:/Comms/Images/Stock images [closed]/Energy Supply/Solar Thermal/Matthews pics/Tube-in-Bracket.jpg"
"Tube-in-Bracket2.jpg","processed/Tube-in-Bracket2.jpg","building material, daylighting, tradesman, roofer, roof, construction, construction worker, brickwork, top, shorts, clothing, shoe, energy supply, solar thermal, matthews pics","thumbnails/Tube-in-Bracket2.jpg","S:/Comms/Images/Stock images [closed]/Energy Supply/Solar Thermal/Matthews pics/Tube-in-Bracket2.jpg"
"Tubes-from-Side.jpg","processed/Tubes-from-Side.jpg","metal, daylighting, solar energy, solar panel, building material, roof, pembrokeshire coast national park, pembrokeshire, renewable energy, energy, energy supply, solar thermal, matthews pics","thumbnails/Tubes-from-Side.jpg","S:/Comms/Images/Stock images [closed]/Energy Supply/Solar Thermal/Matthews pics/Tubes-from-Side.jpg"
"Tubes.JPG","processed/Tubes.JPG","daylighting, steel, pipe, roof, energy supply, solar pv, 1 world solar","thumbnails/Tubes.JPG","S:/Comms/Images/Stock images [closed]/Energy Supply/Solar PV/1 world solar/Tubes.JPG"
